{
  "schema_version": "alice.session_state.v1",
  "thread_id": "slack:C09ALICE:1744746902.000213",
  "updated_at": "2026-04-16T21:47:00Z",
  "active_request_mode": "deep_research",
  "active_resolution_ref": "alice/subject_resolution.json",
  "active_subject_set_kind": "single_parcel",
  "active_subjects": [
    {
      "subject_id": "active_subject_1",
      "display_label": "Confirmed Hudspeth County parcel APN H123-456-7890-0000",
      "subject_kind": "single_parcel",
      "resolution_level": "parcel_resolved",
      "resolution_status": "resolved",
      "parcel_candidate_id": "parcel-48229-h12345678900000"
    }
  ],
  "thesis_snapshot": {
    "summary": "Previously confirmed Hudspeth County parcel being reused for solar-focused follow-up diligence.",
    "use_case_hypotheses": [
      "energy",
      "recreational_rural_hold"
    ],
    "target_geographies": [
      {
        "label": "Hudspeth County, Texas",
        "state_code": "TX",
        "county_fips": "48229",
        "county_name": "Hudspeth County"
      }
    ],
    "filter_notes": [
      "Keep the same confirmed parcel unless the user explicitly replaces it.",
      "User shifted the active thesis from grazing toward small solar plus hold."
    ]
  },
  "artifact_refs": {
    "request_normalized_ref": "alice/request_normalized.json",
    "subject_resolution_ref": "alice/subject_resolution.json",
    "parcel_memo_ref": "alice/parcel_memo.json",
    "report_ref": "alice/report.md",
    "report_summary_ref": "alice/report_summary.json"
  },
  "previous_resolution_refs": [
    "alice/subject_resolution.previous_listing.json"
  ],
  "unresolved_questions": [],
  "user_confirmed_assumptions": [
    "The active parcel from the last report remains the parcel under review."
  ],
  "notes": [
    "This session state is the prior context a follow-up subject_ref should attach to."
  ]
}